,rating,review,processed_review,corrected_review
0,5,GoodREAD MORE,good,good
1,5,Nice camera but battery drain fast specially on video recordingREAD MORE,nice camera batteri drain fast special video record,nice camera battery drain fast special video record
2,5,"Best smart phone under this price range compare to other phones in 2023 if you see overall build quality, performance and Camera with autofocus and video action mode are awesome50% extra RAM compared to iPhone 13 and other more features. Best time to upgrade to iPhone 14 . I am so happy See Low light photos are amazing..READ MORE",best smart phone price rang compar phone 2023 see overal build qualiti perform camera autofocu video action mode awesome50 extra ram compar iphon 13 featur best time upgrad iphon 14 happi see low light photo amaz,best smart phone price rang compare phone 2023 see overall build quality perform camera video action mode awesome extra ram compare siphon 13 feature best time upgrade siphon 14 happy see low light photo amaze
3,5,Just amazing!READ MORE,amaz,amaze
4,4,Nice UI and FastREAD MORE,nice ui fast,nice i fast
5,5,Thanku filipkart best phone in the world ❤️READ MORE,thanku filipkart best phone world ❤️,thank best phone world i
6,4,Awesome 👍READ MORE,awesom 👍,awesome i
7,5,UltimateREAD MORE,ultim,ultima
8,5,I used iPhone 12 mini and now upgraded with iPhone 14. Camera quality is awesome.Full day battery backup.Super Retina display with high dynamic range is awesome.In terms of camera and battery life is big upgrade for me.READ MORE,use iphon 12 mini upgrad iphon 14 camera qualiti awesomeful day batteri backupsup retina display high dynam rang awesomein term camera batteri life big upgrad,use siphon 12 mini upgrade siphon 14 camera quality day battery backups retina display high dynamo rang awesome term camera battery life big upgrade
9,5,Awesome phone with amazing featuresREAD MORE,awesom phone amaz featur,awesome phone amaze feature
10,5,Performance is really good and camera quality is fineREAD MORE,perform realli good camera qualiti fine,perform really good camera quality fine
11,5,Just awesome....❤️🙌😌Display Camera Battery Processor....JUST WOW....✨💗☺️READ MORE,awesome❤️🙌😌display camera batteri processorjust wow✨💗☺️,camera battery
12,5,"Damn such a great phone. Camera is really good, battery lasts long enough, super smooth even though its just 60 hz XDR display. Videos with action mode on are insanely stable and crisp.The night mode can take some really good shots jn low light conditions .The whole apple environment itself is so seamless. I shifted from android to iPhone and it barely took any time since I had iPad and a mac already. With a just a few clicks the phone was ready to go.READ MORE",damn great phone camera realli good batteri last long enough super smooth even though 60 hz xdr display video action mode insan stabl crispth night mode take realli good shot jn low light condit whole appl environ seamless shift android iphon bare took time sinc ipad mac alreadi click phone readi go,damn great phone camera really good battery last long enough super smooth even though 60 he for display video action mode insane stab crisp night mode take really good shot in low light conduit whole apply environs seamless shift android siphon bare took time since ipad mac already click phone ready go
13,5,"Amazing picture quality, awesome design, mind blowing display and fabulous performance and specially very handy phoneREAD MORE",amaz pictur qualiti awesom design mind blow display fabul perform special handi phone,amaze pictur quality awesome design mind blow display kabul perform special hands phone
14,5,Excellent Product 🥳READ MORE,excel product 🥳,excel product i
15,5,Very attractive Must buyLove It❤️❤️READ MORE,attract must buylov it❤️❤️,attract must baylor
16,5,Just perfect!!READ MORE,perfect,perfect
17,5,An absolute beast. This is what you expect after paying such amount. Everything is perfect about this phone from build quality to camera to performance. Absolutely worth it.READ MORE,absolut beast expect pay amount everyth perfect phone build qualiti camera perform absolut worth,absolute beast expect pay amount everyth perfect phone build quality camera perform absolute worth
18,5,Super camera.READ MORE,super camera,super camera
19,5,What a phone.READ MORE,phone,phone
20,5,Reasons to get it over regular 13- 50 percent extra ram- Better camera sensors- Cinematic mode at 4k 30 fps (13 could only do     1080p 30fps)- Action mode for super stabilised videos- Better low light photos thanks to photonic engine- Better battery life - Extra gpu core for high graphics performance- New improved modem for fast and efficient mobile connectivity - Dual ambient light sensors - Better camera flash- Crash detection - Satellite connectivity (though currently not in I...READ MORE,reason get regular 13 50 percent extra ram better camera sensor cinemat mode 4k 30 fp 13 could 1080p 30fp action mode super stabilis video better low light photo thank photon engin better batteri life extra gpu core high graphic perform new improv modem fast effici mobil connect dual ambient light sensor better camera flash crash detect satellit connect though current,reason get regular 13 50 percent extra ram better camera sensor cinema mode ok 30 up 13 could action mode super stabilise video better low light photo thank photon engine better battery life extra gu core high graphic perform new improv modem fast office mobil connect dual ambient light sensor better camera flash crash detect satellite connect though current
21,5,After a losts of efforts when you get then Just Awesome 😊READ MORE,lost effort get awesom 😊,lost effort get awesome i
22,5,"Excellent smart phone, Good battery backup and performance is very good, Good camera quality.READ MORE",excel smart phone good batteri backup perform good good camera qualiti,excel smart phone good battery backup perform good good camera quality
23,5,Iphone 14 Nothing to say about it.... too Fast to furious... thank you Flipkart 👍READ MORE,iphon 14 noth say fast furiou thank flipkart 👍,siphon 14 not say fast furious thank flippant i
24,5,The best camera best design !!1st iphone 14 !!i tried all  conditions light photo the quality is best i was impressed with device battery backup is good perform is very impressive 🔥READ MORE,best camera best design 1st iphon 14 tri condit light photo qualiti best impress devic batteri backup good perform impress 🔥,best camera best design est siphon 14 tri conduit light photo quality best impress devil battery backup good perform impress i
25,5,"Amazing product, love the design and the feel is awesome Performance is very smooth.READ MORE",amaz product love design feel awesom perform smooth,amaze product love design feel awesome perform smooth
26,5,awesome build quality and featuresREAD MORE,awesom build qualiti featur,awesome build quality feature
27,5,"It's a apple device .. that means you get the good old ios . No performance issue , supper ram and power management . My slightly distasteful remark would be on its camera .READ MORE",appl devic mean get good old io perform issu supper ram power manag slightli distast remark would camera,apply devil mean get good old io perform issue supper ram power manage slightly distant remark would camera
28,5,GoodREAD MORE,good,good
29,5,Amazing device for daily life about camera about sound quality all are goodREAD MORE,amaz devic daili life camera sound qualiti good,amaze devil daily life camera sound quality good
30,4,Nice lookREAD MORE,nice look,nice look
31,5,Loved it 👍READ MORE,love 👍,love i
32,5,"Absolutely Awesome, Switching to iPhone was not easy but once i started using this phone. I am loving it.READ MORE",absolut awesom switch iphon easi start use phone love,absolute awesome switch siphon easy start use phone love
33,4,NiceREAD MORE,nice,nice
34,4,Thanks Flipkart for this all new iPhone without any problem I got it and I'm finally Shifted 5 years later  redmi not 5 pro to new. iPhone 14 i really do hard work for this thing Last 8 month  Thanks 😊 I'm happy 😁 ❤️READ MORE,thank flipkart new iphon without problem got im final shift 5 year later redmi 5 pro new iphon 14 realli hard work thing last 8 month thank 😊 im happi 😁 ❤️,thank flippant new siphon without problem got im final shift 5 year later remi 5 pro new siphon 14 really hard work thing last 8 month thank i im happy i i
35,1,Suddenly power off  every 2 -3 min and battery percentage changes and Flipkart not replace  mobileREAD MORE,suddenli power everi 2 3 min batteri percentag chang flipkart replac mobil,suddenly power ever 2 3 min battery percentage chang flippant replace mobil
36,5,Looking Awesome ✨✨READ MORE,look awesom ✨✨,look awesome i
37,5,"Just awesome!!I switch to iPhone 14 from iPhone 12. The powerful chipset gives you smooth performance. No lags, no fancy UI, just delivers the best of it. Camera is best. Battery giving a full day. Speaker sounds wide and clear. Must buy!!READ MORE",awesomei switch iphon 14 iphon 12 power chipset give smooth perform lag fanci ui deliv best camera best batteri give full day speaker sound wide clear must buy,awesome switch siphon 14 siphon 12 power chips give smooth perform lag fancy i deli best camera best battery give full day speaker sound wide clear must buy
38,5,iphone is great Canera qulity is best Battery is powerful All dizine bestWork all best All over bestREAD MORE,iphon great canera quliti best batteri power dizin bestwork best best,siphon great camera quite best battery power dozen network best best
39,5,NiceREAD MORE,nice,nice
40,5,Best phone but same as Iphone 13. There is no difference in 13 and 14.READ MORE,best phone iphon 13 differ 13 14,best phone siphon 13 differ 13 14
41,5,Excellent build quality. Much faster and smootherREAD MORE,excel build qualiti much faster smoother,excel build quality much faster smoother
42,5,Camera is superb.nice phoneREAD MORE,camera superbnic phone,camera supersonic phone
43,5,Great picture quality. Performance is good as always. The important addition is the cinematographic video recordingREAD MORE,great pictur qualiti perform good alway import addit cinematograph video record,great pictur quality perform good alway import admit cinematography video record
44,5,"Totally in love with my new iphone 14. Battery backup is amazing which I never expected from Apple to be very honest.Built quality is excellent and it looks premium. Camera quality is excellent as well. True to life color reproduction, Indoor conditions amazing, night photos are good, facial tones are very good, day clicks are amazing. In short it's an amazing exp. Selfie cam also produces very good quality images.READ MORE",total love new iphon 14 batteri backup amaz never expect appl honestbuilt qualiti excel look premium camera qualiti excel well true life color reproduct indoor condit amaz night photo good facial tone good day click amaz short amaz exp selfi cam also produc good qualiti imag,total love new siphon 14 battery backup amaze never expect apply quality excel look premium camera quality excel well true life color reproduce indoor conduit amaze night photo good facial tone good day click amaze short amaze ex self cam also produce good quality image
45,5,"Review after a week Overall a powerful package for photo, video and gaming. Only thing which could have been better is battery, though it works whole day with low usage , but extensive use it would not go beyond half day.Camera 4/5Pictures in full zoom- 3Sound quality- 5/5Display- 4.5/5Performance- 5READ MORE",review week overal power packag photo video game thing could better batteri though work whole day low usag extens use would go beyond half daycamera 45pictur full zoom 3sound qualiti 55display 455perform 5,review week overall power package photo video game thing could better battery though work whole day low usage extend use would go beyond half pictur full zoom sound quality display 5
46,5,Decent purchase:)READ MORE,decent purchas,decent purchase
47,5,"Happy to have iPhone 14. Wonderful phone specially because of Powerful camera😍, perfect screen size and potentially battery life make it worthy.READ MORE",happi iphon 14 wonder phone special power camera😍 perfect screen size potenti batteri life make worthi,happy siphon 14 wonder phone special power camera perfect screen size potent battery life make worth
48,1,"The volume down button is struck and unable to volume up. The Flipkart team is saying it is open box delivery so they can't help.......how can we check the volume without opening/start the mobile, when i ask this question the customer support placing my call on hold and dropping my callREAD MORE",volum button struck unabl volum flipkart team say open box deliveri cant helphow check volum without openingstart mobil ask question custom support place call hold drop call,volume button struck unable volume flippant team say open box deliver cant helpyou check volume without mobil ask question custom support place call hold drop call
49,5,You ever Heard the word Satisfaction...Yesss that is exactly how it feels to have it.READ MORE,ever heard word satisfactionyesss exactli feel,ever heard word exactly feel
50,5,Nice looking phone.READ MORE,nice look phone,nice look phone
51,5,"My 1st IOS device so far good😊Midnight Black the best you can have, the Camera quality is excellent along with the multitasking performance. Go for it!READ MORE",1st io devic far good😊midnight black best camera qualiti excel along multitask perform go,est io devil far black best camera quality excel along multitask perform go
52,5,Camera cinematic next level🔥🔥READ MORE,camera cinemat next level🔥🔥,camera cinema next level
53,5,"Best in class in all the aspects. Top notch performance for display, camera and everything.READ MORE",best class aspect top notch perform display camera everyth,best class aspect top notch perform display camera everyth
54,5,Love IPhone Dream IPhone..💜😍✌️🖤READ MORE,love iphon dream iphone💜😍✌️🖤,love siphon dream
55,5,"Very nice product, camera quality is just amazing everything seems too real.Phone is very fast.READ MORE",nice product camera qualiti amaz everyth seem realphon fast,nice product camera quality amaze everyth seem fast
56,5,Best camera phoneREAD MORE,best camera phone,best camera phone
57,5,Really an overall great productREAD MORE,realli overal great product,really overall great product
58,5,Love itREAD MORE,love,love
59,4,4 out of 5 Phone was so handy and superbREAD MORE,4 5 phone handi superb,4 5 phone hands superb
60,5,Absolutely AwesomeREAD MORE,absolut awesom,absolute awesome
61,5,Quality + Performance + Integrity = Apple IncREAD MORE,qualiti perform integr appl inc,quality perform inter apply inc
62,5,Very good phoneREAD MORE,good phone,good phone
63,5,My First iphone experience even though its 60hz refresh rate but feels so smooth and optimized and performance is top notch🔥..if u r looking for an iphone 13..go for i phone 14 trust me u will love it❤️READ MORE,first iphon experi even though 60hz refresh rate feel smooth optim perform top notch🔥if u r look iphon 13go phone 14 trust u love it❤️,first siphon expert even though refresh rate feel smooth optic perform top u i look siphon go phone 14 trust u love it
64,5,Superb qualityREAD MORE,superb qualiti,superb quality
65,5,Good one got it around 67k . This is my first Apple mobile. Took time to get habituated to apple eco system but worth the wait. Simple and easy.READ MORE,good one got around 67k first appl mobil took time get habitu appl eco system worth wait simpl easi,good one got around ask first apply mobil took time get habit apply eco system worth wait simple easy
66,5,Value for money product if you get the deal around 65 k .READ MORE,valu money product get deal around 65 k,value money product get deal around 65 i
67,5,Awesome cameraREAD MORE,awesom camera,awesome camera
68,5,NiceREAD MORE,nice,nice
69,5,Amazing deviceI switch to iPhone 14 from iPhone 8. Great camera and power management full day battery backup. Sound quality and display also awesome. Just go for it if you have enough moneyREAD MORE,amaz devicei switch iphon 14 iphon 8 great camera power manag full day batteri backup sound qualiti display also awesom go enough money,amaze device switch siphon 14 siphon 8 great camera power manage full day battery backup sound quality display also awesome go enough money
70,5,Superb camera and performance... Battery life is also good.... Great Display and awesome looks... 60hz refresh rate is better than android 90hz... Loved it ❤READ MORE,superb camera perform batteri life also good great display awesom look 60hz refresh rate better android 90hz love ❤,superb camera perform battery life also good great display awesome look refresh rate better android love i
71,5,Nice oneREAD MORE,nice one,nice one
72,5,This is my first IOS device and I like it..I gifted this to my younger brother and he loved it. iPhone in-hand feel is damn premium 🙌🏻 also the camera quality is top notch to be honest I bought this phone only for smooth processor and camera quality. Just go for itREAD MORE,first io devic like iti gift younger brother love iphon inhand feel damn premium 🙌🏻 also camera qualiti top notch honest bought phone smooth processor camera qualiti go,first io devil like iti gift younger brother love siphon inland feel damn premium i also camera quality top notch honest bought phone smooth processor camera quality go
73,5,Best in the market. Camera quality awesome Battery easily goes for a daySpeakers are really good.READ MORE,best market camera qualiti awesom batteri easili goe dayspeak realli good,best market camera quality awesome battery easily got daybreak really good
74,5,I just love this phone  for the 1st time and the performance is awesome  just wow camera quality battery everything is awesome . I prefer anyone who can use this phone . Iphone using it for the 1st time never getting any problem . Just thank you Flipkart for providing me these at low cost as compared to retail shops . Thank you Flipkart and Apple . Just love it .READ MORE,love phone 1st time perform awesom wow camera qualiti batteri everyth awesom prefer anyon use phone iphon use 1st time never get problem thank flipkart provid low cost compar retail shop thank flipkart appl love,love phone est time perform awesome wow camera quality battery everyth awesome prefer anyon use phone siphon use est time never get problem thank flippant provide low cost compare retail shop thank flippant apply love
75,5,Amazing!pictures...📸 everything good 😍READ MORE,amazingpictures📸 everyth good 😍,everyth good i
76,5,Good nice trusted i checked everything i was conserned about weather I'll get fooled by delivery and all but it was new i checked everything as people used to say we get refurbished phone no it was good new freshREAD MORE,good nice trust check everyth consern weather ill get fool deliveri new check everyth peopl use say get refurbish phone good new fresh,good nice trust check everyth concern weather ill get fool deliver new check everyth peopl use say get refurbish phone good new fresh
77,5,Awesome deal Tq Flipkart.IPhone 14 was powerfully packed 5G .Battery is good.Cameras next level .finally iPhone 14 is superb.loved ItREAD MORE,awesom deal tq flipkartiphon 14 power pack 5g batteri goodcamera next level final iphon 14 superblov,awesome deal to 14 power pack og battery next level final siphon 14 superbly
78,5,THE product is genuinely awesome.. and can't stop my etes from looking into the product.. Awesome work by APPLE and good customer support from seller and Flipkart...THANKS FOR THE PRODUCT... GO FOR ITREAD MORE,product genuin awesom cant stop ete look product awesom work appl good custom support seller flipkartthank product go,product genuine awesome cant stop ete look product awesome work apply good custom support seller product go
79,5,I'm happy with the phone and the deal I got from the Flipkart.READ MORE,im happi phone deal got flipkart,im happy phone deal got flippant
80,5,Very niceREAD MORE,nice,nice
81,5,Best Phone in market.READ MORE,best phone market,best phone market
82,5,"No doubt, awesome product, go for itREAD MORE",doubt awesom product go,doubt awesome product go
83,5,Best qualityREAD MORE,best qualiti,best quality
84,5,Excellent camera😊READ MORE,excel camera😊,excel camera
85,5,Nice Cinematic Video and Portrait photographyREAD MORE,nice cinemat video portrait photographi,nice cinema video portrait photograph
86,1,Don't buy..... More heatingREAD MORE,dont buy heat,dont buy heat
87,5,Just wow😍😘READ MORE,wow😍😘,wow
88,5,"Excellent Smartphone, Amazing Picture quality, Good sound qualityREAD MORE",excel smartphon amaz pictur qualiti good sound qualiti,excel smartphone amaze pictur quality good sound quality
89,5,Amazing Product 😇💯READ MORE,amaz product 😇💯,amaze product i
90,5,SuperbREAD MORE,superb,superb
91,5,I think this is wow what a performance camera too good love itREAD MORE,think wow perform camera good love,think wow perform camera good love
92,5,It looks so pretty 🫣❤️READ MORE,look pretti 🫣❤️,look pretty
93,5,GoodREAD MORE,good,good
94,5,iPhone 14 starlight 🤍 beautiful design excellent camera great battery. I think it is better than previous year iPhone 13. Go for it 👌READ MORE,iphon 14 starlight 🤍 beauti design excel camera great batteri think better previou year iphon 13 go 👌,siphon 14 starlight i beauty design excel camera great battery think better previous year siphon 13 go i
95,5,"Genuine and nice,worthy upgrade considering technical enhancements over IPhone 13(may not be for 13 users),like better sensor and low light performance, extra 2gb ram,5 core Gpu(as in 13 pro) and  longer ios support.New ios 16 is stable.Flipkart service is good.READ MORE",genuin niceworthi upgrad consid technic enhanc iphon 13may 13 userslik better sensor low light perform extra 2gb ram5 core gpua 13 pro longer io supportnew io 16 stableflipkart servic good,genuine upgrade consider technics enhance siphon may 13 better sensor low light perform extra go ram core gpa 13 pro longer io supported io 16 service good
96,5,"Great phone with great capabilities 🔥Excellent camera 📸Processor same as my 13pro New blue colour is awesome ❤️I have :- 14pro . 13pro . 12. 12mini . Also new this one iphone 14 . One thing is common in all have , there is no lag till the date. The one thing I always said it is what it is🔥🔥READ MORE",great phone great capabl 🔥excel camera 📸processor 13pro new blue colour awesom ❤️i 14pro 13pro 12 12mini also new one iphon 14 one thing common lag till date one thing alway said is🔥🔥,great phone great capable excel camera processor pro new blue colour awesome i pro pro 12 mini also new one siphon 14 one thing common lag till date one thing alway said is
97,5,"I wanted to buy yellow colour but that was not delivering on my pin code so went for this colour.After receiving this, I have no regression.Love this.iPhone heats a lot because of its built. Its frame is steel and the back is glass but it has great things when it gets hot, it restricts some features to cool it down.The camera is good, sometimes it misses focus.Performance is the best part of it.READ MORE",want buy yellow colour deliv pin code went colouraft receiv regressionlov thisiphon heat lot built frame steel back glass great thing get hot restrict featur cool downth camera good sometim miss focusperform best part,want buy yellow colour deli pin code went receive heat lot built frame steel back glass great thing get hot restrict feature cool dowith camera good sometime miss best part
98,5,I using this mobile for 2 days before I using Samsung m30 so..... This iPhone was very handy Performance a15 bionic with 6 core processorWe can't find the difference day to day life soo...this is awesome next camera camera is top notch I don't how to tell in words this very good camera same as dslr and videos is soo good quality but action mode is take 2.8k resolution and in dimlight is was sooo bad so while you take with action use gimbal ..... And over all the phone very good 👍READ MORE,use mobil 2 day use samsung m30 iphon handi perform a15 bionic 6 core processorw cant find differ day day life soothi awesom next camera camera top notch dont tell word good camera dslr video soo good qualiti action mode take 28k resolut dimlight sooo bad take action use gimbal phone good 👍,use mobil 2 day use sassing my siphon hands perform a bionic 6 core processor cant find differ day day life soothe awesome next camera camera top notch dont tell word good camera door video soo good quality action mode take ask resolute daylight sooo bad take action use gimbal phone good i
99,5,Camera and battery Quality us best in this segmentREAD MORE,camera batteri qualiti us best segment,camera battery quality us best segment
100,5,SuperREAD MORE,super,super
