,rating,review,processed_review,corrected_review
101,5,"Very good purchase.i bought it for my wife as a Padwa gift.but just my views on purchasing this expensive phone- if you are using Iphone very lower version go for it but if you are already in iphone 13 or 11 do not spend money,its not worth.no much change.but if you have lots of money then go for it.wife was using iphone 7 hence i purchased this latest one.now no purchase atleast for 6 years. iphone 7 also used 5 years and believe me it has no issues at all, but the only problem was batte...READ MORE",good purchasei bought wife padwa giftbut view purchas expens phone use iphon lower version go alreadi iphon 13 11 spend moneyit worthno much changebut lot money go itwif use iphon 7 henc purchas latest onenow purchas atleast 6 year iphon 7 also use 5 year believ issu problem batt,good purchase bought wife papa view purchase expense phone use siphon lower version go already siphon 13 11 spend money worth much lot money go twin use siphon 7 hence purchase latest oneof purchase atleast 6 year siphon 7 also use 5 year believ issue problem butt
102,3,"The iPhone 14 is a solid choice for those looking for a high-quality smartphone experience. The camera is top-notch, the performance is smooth, and the design is sleek and modern. However, there are a few drawbacks to consider when comparing it to Android phones.One of the biggest cons of the iPhone 14 is its lack of customization options. Apple has a strict policy on what apps and features can be used on their devices, which can be frustrating for users who want more control over their pho...READ MORE",iphon 14 solid choic look highqual smartphon experi camera topnotch perform smooth design sleek modern howev drawback consid compar android phoneson biggest con iphon 14 lack custom option appl strict polici app featur use devic frustrat user want control pho,siphon 14 solid choice look smartphone expert camera topnotch perform smooth design sleek modern howe drawback consider compare android phones biggest con siphon 14 lack custom option apply strict police app feature use devil frustrate user want control pho
103,3,Superb performanceREAD MORE,superb perform,superb perform
104,5,Excellent camera 😍READ MORE,excel camera 😍,excel camera i
105,5,Looking 🔥..i lv thisREAD MORE,look 🔥i lv,look i la
106,5,OkREAD MORE,ok,ok
107,5,Best one. Have not used a better mobile than this yet. currently one of the best phone in the market.READ MORE,best one use better mobil yet current one best phone market,best one use better mobil yet current one best phone market
108,4,Thanks Flipkart service is fine nd it comes in a 2 days.product is genuine nd I love itREAD MORE,thank flipkart servic fine nd come 2 daysproduct genuin nd love,thank flippant service fine and come 2 genuine and love
109,5,It's a perfect mobile. Comfortable in hands... Size is good. Looks so classy. For me it's the bestREAD MORE,perfect mobil comfort hand size good look classi best,perfect mobil comfort hand size good look class best
110,5,Camera is good and speaker and display is awesome. Overall nice.READ MORE,camera good speaker display awesom overal nice,camera good speaker display awesome overall nice
111,5,Simply superb so farNo complaints as of nowPhone was delivered within one day after orderREAD MORE,simpli superb farno complaint nowphon deliv within one day order,simple superb faro complaint deli within one day order
112,5,AstoundingREAD MORE,astound,astound
113,5,"No two ways , it's a great product, I haven't used iPhone before, this feels real good phone , great battery life , iOS is really better in stability and speedREAD MORE",two way great product havent use iphon feel real good phone great batteri life io realli better stabil speed,two way great product havent use siphon feel real good phone great battery life io really better tail speed
114,5,Overall good productREAD MORE,overal good product,overall good product
115,5,"Better than iphone 13. Especially that 13 number is considered unlucky. Moreover, better camera, battery, quality. And finally, color purple is very nice Namaste🙏READ MORE",better iphon 13 especi 13 number consid unlucki moreov better camera batteri qualiti final color purpl nice namaste🙏,better siphon 13 expect 13 number consider unlucky more better camera battery quality final color purple nice namaste
116,5,Superb camera qualityREAD MORE,superb camera qualiti,superb camera quality
117,4,Best productREAD MORE,best product,best product
118,5,"I am very happy with the purchase , i was confused between blue and yellow but yellow is very bright and refreshing color and look different  blue is also nice but after putting back cover we can not differentiate if its is iphone 13 or 14 better go for yellow iphone its very bright and attractive lot of people asked me if i bough new iphone or something thankyou flipkart now comes to the performance battery is good display is very smooth looks very premiums n feels very premium. Go for itREAD MORE",happi purchas confus blue yellow yellow bright refresh color look differ blue also nice put back cover differenti iphon 13 14 better go yellow iphon bright attract lot peopl ask bough new iphon someth thankyou flipkart come perform batteri good display smooth look premium n feel premium go,happy purchase confuse blue yellow yellow bright refresh color look differ blue also nice put back cover different siphon 13 14 better go yellow siphon bright attract lot peopl ask bough new siphon someth thankyou flippant come perform battery good display smooth look premium i feel premium go
119,5,Vary goodREAD MORE,vari good,vary good
120,5,"Excellent smart phone, Good battery backup and performance is very good, Good camera quality.READ MORE",excel smart phone good batteri backup perform good good camera qualiti,excel smart phone good battery backup perform good good camera quality
121,5,No wordsREAD MORE,word,word
122,1,Worst phoneREAD MORE,worst phone,worst phone
123,4,Good mobileREAD MORE,good mobil,good mobil
124,5,Best cameraREAD MORE,best camera,best camera
125,5,Good priceREAD MORE,good price,good price
126,5,NiceREAD MORE,nice,nice
127,1,Battery performance too lowREAD MORE,batteri perform low,battery perform low
128,3,Handy. Premium fellingREAD MORE,handi premium fell,hands premium fell
129,5,Best phone but same as Iphone 13. There is no difference in 13 and 14.READ MORE,best phone iphon 13 differ 13 14,best phone siphon 13 differ 13 14
130,1,Bad refresh rate at this price point. It looks way too slow after using Android phone above 90 hz displayREAD MORE,bad refresh rate price point look way slow use android phone 90 hz display,bad refresh rate price point look way slow use android phone 90 he display
131,4,"super smooth, mic quality seems to be disappointingotherwise quality wise product is goodREAD MORE",super smooth mic qualiti seem disappointingotherwis qualiti wise product good,super smooth mic quality seem quality wise product good
132,5,Totally worth selling your kidney and buying this amazing phone. Camera makes this phone A+READ MORE,total worth sell kidney buy amaz phone camera make phone,total worth sell kidney buy amaze phone camera make phone
133,5,"✓Comfortable, high-end build✓OLED screen looks fantastic✓A15 chip performs great✓Good camera upgrades✓Dependable battery lifeREAD MORE",✓comfort highend build✓ol screen look fantastic✓a15 chip perform great✓good camera upgrades✓depend batteri life,comfort higher screen look chip perform camera battery life
134,5,Nice phone but battery drane more while using camera and battery is less useableREAD MORE,nice phone batteri drane use camera batteri less useabl,nice phone battery drank use camera battery less useable
135,1,Battery very low time not supporting FlipkartREAD MORE,batteri low time support flipkart,battery low time support flippant
136,5,Best mobile ever nd Yellow colour one of my favoriteREAD MORE,best mobil ever nd yellow colour one favorit,best mobil ever and yellow colour one favorite
137,5,Nice performanceREAD MORE,nice perform,nice perform
138,5,I was a little sceptical about the red color but it looks premium. Amazing feel and touch. Love it..READ MORE,littl sceptic red color look premium amaz feel touch love,little sceptic red color look premium amaze feel touch love
139,5,Great phoneREAD MORE,great phone,great phone
140,5,Amazing product 👍READ MORE,amaz product 👍,amaze product i
141,5,GoodREAD MORE,good,good
142,5,"First ever experiencing Iphone. Being an android user and switching over to Iphone and using it for a day makes me a step away from android. 1.Top Class Performance2. High defined Camera and Cinematic Video 3. Pocket friendly comparing pro and plus models4. Have a concern on Battery , though drains on a single day usage - It doesnt means a negative feedback since its 20W Charger charged from 3 to 60 at a time of 10 minutes. I was too surprised- The best class in Apple Series.Last but n...READ MORE",first ever experienc iphon android user switch iphon use day make step away android 1top class performance2 high defin camera cinemat video 3 pocket friendli compar pro plu models4 concern batteri though drain singl day usag doesnt mean neg feedback sinc 20w charger charg 3 60 time 10 minut surpris best class appl serieslast n,first ever experience siphon android user switch siphon use day make step away android stop class performance high define camera cinema video 3 pocket friendly compare pro plus models concern battery though drain single day usage doesn't mean neg feedback since how charger charge 3 60 time 10 minut surprise best class apply i
143,4,Have recently moved over from Android to IOS. Felt very happy about it.READ MORE,recent move android io felt happi,recent move android io felt happy
144,5,Awesome productREAD MORE,awesom product,awesome product
145,4,SuperREAD MORE,super,super
146,1,Heating issuesREAD MORE,heat issu,heat issue
147,5,"Great phone with great capabilities 🔥Excellent camera 📸Processor same as my 13pro New blue colour is awesome ❤️I have :- 14pro . 13pro . 12. 12mini . Also new this one iphone 14 . One thing is common in all have , there is no lag till the date. The one thing I always said it is what it is🔥🔥READ MORE",great phone great capabl 🔥excel camera 📸processor 13pro new blue colour awesom ❤️i 14pro 13pro 12 12mini also new one iphon 14 one thing common lag till date one thing alway said is🔥🔥,great phone great capable excel camera processor pro new blue colour awesome i pro pro 12 mini also new one siphon 14 one thing common lag till date one thing alway said is
148,5,Lovely phone.. camera is very good 👍Awesome product.....READ MORE,love phone camera good 👍awesom product,love phone camera good awesome product
149,5,Awesome 😎READ MORE,awesom 😎,awesome i
150,5,The product was as expectedREAD MORE,product expect,product expect
151,4,GoodREAD MORE,good,good
152,5,Premium ProductREAD MORE,premium product,premium product
153,2,My charger cable is not workingREAD MORE,charger cabl work,charger call work
154,1,The display got damaged with green lines only after using it for ten to twelve days 😭😭READ MORE,display got damag green line use ten twelv day 😭😭,display got damage green line use ten twelve day i
155,5,NiceREAD MORE,nice,nice
156,5,Excellent 👌READ MORE,excel 👌,excel i
157,5,Amazing.loved this colour.READ MORE,amazinglov colour,amazingly colour
158,5,The colour is fantastic ☺️ and performing very well value for moneyREAD MORE,colour fantast ☺️ perform well valu money,colour fantasy i perform well value money
159,5,The battery life is best on iPhoneREAD MORE,batteri life best iphon,battery life best siphon
160,5,Great phone and great delivery by flipkartREAD MORE,great phone great deliveri flipkart,great phone great deliver flippant
161,5,🤷 what are u expecting me to say? You already know Iphone is IphoneREAD MORE,🤷 u expect say alreadi know iphon iphon,i u expect say already know siphon siphon
162,5,Switched from Xiaomi 12 Pro that was a heater means heats lot much it is very cool device I also used iPhone 13 but it has little bit more better that iPhone 13 best deviceREAD MORE,switch xiaomi 12 pro heater mean heat lot much cool devic also use iphon 13 littl bit better iphon 13 best devic,switch xiaoyi 12 pro heater mean heat lot much cool devil also use siphon 13 little bit better siphon 13 best devil
163,5,"I had upgraded from XR to 14.. So it’s amazing❤️ But if you are already using 13 means, either upgrade it to 14 pro or don’t buy this.Ditto as iPhone 13.READ MORE",upgrad xr 14 it’ amazing❤️ alreadi use 13 mean either upgrad 14 pro don’t buy thisditto iphon 13,upgrade or 14 it amazing already use 13 mean either upgrade 14 pro don't buy siphon 13
164,5,Dream come true 👍 ✨️READ MORE,dream come true 👍 ✨️,dream come true i i
165,5,Worth of money.!READ MORE,worth money,worth money
166,5,Just amazingREAD MORE,amaz,amaze
167,5,Nice product  i am so happy😊😊😊READ MORE,nice product happy😊😊😊,nice product
168,5,NiceREAD MORE,nice,nice
169,5,Perfect as per reputation of the iPhone. Having pride of owning this piece of iPhone- Assembled in India 🇮🇳READ MORE,perfect per reput iphon pride own piec iphon assembl india 🇮🇳,perfect per repute siphon pride own piece siphon assemble india i
170,4,Nothing is bad in this phone i am using it for 1 month but tbh it did not meet my expectations .Looking at the price point i beleave it should not be sold greater than 40k.This is my first Iphone i just hope in the long run i get the value in return.Its a dream for many indians to own a iphone atleast once in a life time  i believe now that there are so many offers its not as hard as owning a iphone as it was before.You should always fullfill your dream no matter what is the costREAD MORE,noth bad phone use 1 month tbh meet expect look price point beleav sold greater 40kthi first iphon hope long run get valu returnit dream mani indian iphon atleast life time believ mani offer hard own iphon beforey alway fullfil dream matter cost,not bad phone use 1 month tbe meet expect look price point bleak sold greater first siphon hope long run get value return dream mani indian siphon atleast life time believ mani offer hard own siphon before alway fulfil dream matter cost
171,5,Superb phone. Design could have been new but good performance . Purple color looks pretty decent. Light shade.READ MORE,superb phone design could new good perform purpl color look pretti decent light shade,superb phone design could new good perform purple color look pretty decent light shade
172,3,Overall good performanceREAD MORE,overal good perform,overall good perform
173,5,Nice phone🔥❤️READ MORE,nice phone🔥❤️,nice
174,4,Awesome 👍READ MORE,awesom 👍,awesome i
175,3,Performance quality is goodREAD MORE,perform qualiti good,perform quality good
176,5,"Awesome Phone, camera is too good, This is my 4 th I phone from FlipkartREAD MORE",awesom phone camera good 4 th phone flipkart,awesome phone camera good 4 the phone flippant
177,5,Good product redREAD MORE,good product red,good product red
178,5,Best phone under this price range ...READ MORE,best phone price rang,best phone price rang
179,5,nice 😍READ MORE,nice 😍,nice i
180,5,Very good ✌️😍😍✌️READ MORE,good ✌️😍😍✌️,good
181,4,"Battery life is not as good as i thought it would be. Transferring through an android phone and forgot to use move to iphone application, don't make this mistake. Otherwise overall good phone. The photos are pretty good actually ( main reason why i spend so much money behind it lol ). Other than that, it's an apple so yeah theres that.READ MORE",batteri life good thought would transfer android phone forgot use move iphon applic dont make mistak otherwis overal good phone photo pretti good actual main reason spend much money behind lol appl yeah there,battery life good thought would transfer android phone forgot use move siphon apply dont make mistak otherwise overall good phone photo pretty good actual main reason spend much money behind lol apply yeah there
182,5,Very good... Value for moneyREAD MORE,good valu money,good value money
183,5,Great ProductREAD MORE,great product,great product
184,5,Happy .....READ MORE,happi,happy
185,1,Back glass very low qualityREAD MORE,back glass low qualiti,back glass low quality
186,5,AmazingREAD MORE,amaz,amaze
187,5,Camera quality is very goodREAD MORE,camera qualiti good,camera quality good
188,5,Great experience.READ MORE,great experi,great expert
189,5,Good upgrade and at good price .READ MORE,good upgrad good price,good upgrade good price
190,5,Fabulous iphone and i love always iphoneREAD MORE,fabul iphon love alway iphon,kabul siphon love alway siphon
191,5,Nice 👍 varun tinker my phone bestREAD MORE,nice 👍 varun tinker phone best,nice i arun tinker phone best
192,4,"The Apple iPhone 14 is a great choice for anyone looking for a reliable, fast and stylish smartphone. It has a 6.1-inch OLED display that delivers vibrant colors and sharp details, and a powerful A15 Bionic chip that handles everything from gaming to multitasking with ease. The iPhone 14 also has an improved camera system that captures stunning photos and videos in any lighting condition, thanks to its 12MP wide-angle lens with optical image stabilization, Smart HDR 4 and Action mode. The iPh...READ MORE",appl iphon 14 great choic anyon look reliabl fast stylish smartphon 61inch ole display deliv vibrant color sharp detail power a15 bionic chip handl everyth game multitask eas iphon 14 also improv camera system captur stun photo video light condit thank 12mp wideangl len optic imag stabil smart hdr 4 action mode iph,apply siphon 14 great choice anyon look reliable fast stylish smartphone inch ole display deli vibrant color sharp detail power a bionic chip hands everyth game multitask eas siphon 14 also improv camera system capture stun photo video light conduit thank jump len optic image tail smart her 4 action mode ich
193,4,Powerful processorGreat display Great cameraLess batteryREAD MORE,power processorgreat display great cameraless batteri,power display great battery
194,1,"The product is fine, the buying experience was horrible. Better to avoid buying anything from Flipkart.READ MORE",product fine buy experi horribl better avoid buy anyth flipkart,product fine buy expert horrible better avoid buy anyth flippant
195,1,Not worth it..Camera sensor not really powerful although processing software is good. Good for videos not so much for stills.READ MORE,worth itcamera sensor realli power although process softwar good good video much still,worth camera sensor really power although process software good good video much still
196,2,Battery getting down fastREAD MORE,batteri get fast,battery get fast
197,5,The smoothness of the phone is excellent. Battery is okayish if you switch from android. Camera is one the best.READ MORE,smooth phone excel batteri okayish switch android camera one best,smooth phone excel battery grayish switch android camera one best
198,5,Superb 😎READ MORE,superb 😎,superb i
199,5,Awesome ProductMust buyREAD MORE,awesom productmust buy,awesome buy
200,5,I upgraded from iphone 12. Much better than iphone 12. Love itREAD MORE,upgrad iphon 12 much better iphon 12 love,upgrade siphon 12 much better siphon 12 love
201,5,I switched to 14 from Xr means LCD to OLED DISPLAY😍And the display was just awesomeBattery is effective according to daily usageTop notch performance Best in class mobile 👌🏼READ MORE,switch 14 xr mean lcd ole display😍and display awesomebatteri effect accord daili usagetop notch perform best class mobil 👌🏼,switch 14 or mean led ole display effect accord daily notch perform best class mobil i
202,5,Good 14 ❤️READ MORE,good 14 ❤️,good 14 i
203,5,Best Camera qualityREAD MORE,best camera qualiti,best camera quality
204,5,Just go for it. And starlight is lob🤍READ MORE,go starlight lob🤍,go starlight lobe
205,5,Excellent experience with iPhone. Very nice product.READ MORE,excel experi iphon nice product,excel expert siphon nice product
206,4,Product is good...bt battary is average.READ MORE,product goodbt battari averag,product good bastard average
207,5,Very nice product. Amazing 😍READ MORE,nice product amaz 😍,nice product amaze i
208,5,Oh !!! What a phone!!Purple colour looks more premium.Switching from mid range android phone to iOS is really a mesmerising feel.READ MORE,oh phonepurpl colour look premiumswitch mid rang android phone io realli mesmeris feel,oh colour look mid rang android phone io really mesmeric feel
209,5,Thanks FlipkartREAD MORE,thank flipkart,thank flippant
210,5,Nice excellentREAD MORE,nice excel,nice excel
211,1,Wasn't mobile don't buyREAD MORE,wasnt mobil dont buy,want mobil dont buy
212,4,Everything is good except camera.READ MORE,everyth good except camera,everyth good except camera
213,1,I feel sad to see the charging time and camera quality. Also double tap in back side is very unresponsive and time takingREAD MORE,feel sad see charg time camera qualiti also doubl tap back side unrespons time take,feel sad see charge time camera quality also doubt tap back side time take
214,5,Great phoneREAD MORE,great phone,great phone
215,1,Really disappointed with display and performance. Lagging in bgmi with graphics settings smooth + extreme. Hardly 50 fps. While lagging gives 25-30 fps which is frustrating for device like this.READ MORE,realli disappoint display perform lag bgmi graphic set smooth extrem hardli 50 fp lag give 2530 fp frustrat devic like,really disappoint display perform lag big graphic set smooth extreme hardly 50 up lag give 2530 up frustrate devil like
216,1,"I Purchased I phone 14 , and after 10 days it went dead, don't purchase itREAD MORE",purchas phone 14 10 day went dead dont purchas,purchase phone 14 10 day went dead dont purchase
217,5,Very nice phone. Totally worth itREAD MORE,nice phone total worth,nice phone total worth
218,1,When I put a charge phone is heatingREAD MORE,put charg phone heat,put charge phone heat
219,5,Loved it 😊READ MORE,love 😊,love i
220,5,Fantastic 🔥⚡️READ MORE,fantast 🔥⚡️,fantasy
221,5,"What a fabulous phone after using 1 monthI know in design it is similar to Iphone 13 but is specs aren't.There is substantial difference in display, battery, speed as compared to iPhone 13.Its-Battery easily lasts more than 1 day in moderate usage.Camera is fabulous.Display is excellent.Handy device.But heats sometimes while executing smaller tasks.I have Iphone Xs max. Its was a drastic upgrade from the same in terms of display, battery, speed ie hardware.But more concerning is ...READ MORE",fabul phone use 1 monthi know design similar iphon 13 spec arentther substanti differ display batteri speed compar iphon 13itsbatteri easili last 1 day moder usagecamera fabulousdisplay excellenthandi devicebut heat sometim execut smaller tasksi iphon xs max drastic upgrad term display batteri speed ie hardwarebut concern,kabul phone use 1 months know design similar siphon 13 spec substantia differ display battery speed compare siphon easily last 1 day modern heat sometime execute smaller tasks siphon is max drastic upgrade term display battery speed ie concern
222,5,Superb product love it ❤️READ MORE,superb product love ❤️,superb product love i
223,5,Very nice lookREAD MORE,nice look,nice look
224,5,AwesomeREAD MORE,awesom,awesome
225,5,Awesome Product Apple Fast deliveryREAD MORE,awesom product appl fast deliveri,awesome product apply fast deliver
226,5,Really awesome and geniune product provided by flipkart . Thank you so much for making my life happy. All things are great not a single defect in this unit.READ MORE,realli awesom geniun product provid flipkart thank much make life happi thing great singl defect unit,really awesome genius product provide flippant thank much make life happy thing great single defect unit
227,5,amazing product😊nice flipkart service😍I'm happy🤗READ MORE,amaz product😊nic flipkart service😍im happy🤗,amaze flippant happy
228,5,upgraded with my I phone 12 and satisfied with product. the experience u can get once u have it.READ MORE,upgrad phone 12 satisfi product experi u get u,upgrade phone 12 satisfy product expert u get u
229,5,Nice productREAD MORE,nice product,nice product
230,5,Excellent.READ MORE,excel,excel
231,5,"The iPhone 14 is a standout device in Apple's latest lineup. With its sleek design, powerful hardware and improved cameras, it's a must-have for any tech enthusiast.Pros:    Powerful hardware with the A16 chip.    Improved camera quality.    Long battery life.    Sleek design with premium build quality.    Improved display technology for an immersive experience.    Great operating system with a large app store.Cons:    Expensive compared to other smartphones.    No headphone jack...READ MORE",iphon 14 standout devic appl latest lineup sleek design power hardwar improv camera musthav tech enthusiastpro power hardwar a16 chip improv camera qualiti long batteri life sleek design premium build qualiti improv display technolog immers experi great oper system larg app storecon expens compar smartphon headphon jack,siphon 14 standout devil apply latest lineup sleek design power hardware improv camera musthave tech power hardware a chip improv camera quality long battery life sleek design premium build quality improv display technology immerse expert great over system large app expense compare smartphone headphone jack
232,1,GoodREAD MORE,good,good
